{"schemaVersion":2,"feature":"i-4-vocabulary-test","tier":"developer","targetStage":"developer","pinnedFiles":[{"path":"internal/intake/vocabulary.go","reason":"The six unexported Go sets (knownTypes, knownStatuses, knownSources, knownTrust, knownFinishes, knownAutonomies) the new test must read directly, since it lives in package intake — this is the change's seed file."},{"path":"templates/claude-feature-team/intake/TEMPLATE.md","reason":"The other side of the comparison: the trailing `# a | b | c` comment on each of the six frontmatter fields (lines 9, 11, 15, 17, 19, 20) that the new test must parse and diff against vocabulary.go's sets."},{"path":"templates/claude-feature-team/intake/README.md","reason":"Holds the `status` table (the Lifecycle table, lines ~21-25) whose first column the second AC requires reading and comparing against knownStatuses."},{"path":"internal/intake/order.go","reason":"Defines Order and SchemaVersion and the package doc-comment; the developer needs this to know the existing field names and package conventions before adding a new file to the same package."},{"path":"internal/intake/validate.go","reason":"Distance-1 exact dependent: the only existing consumer of vocabulary.go's known* sets (checkVocabulary, listOf). Shows the established pattern for iterating the six fields that the new test should mirror for consistency."},{"path":"internal/intake/parse_test.go","reason":"TestTheShippedTemplateParses (lines 122-136) is the existing precedent for a test in this package reading the shipped TEMPLATE.md via runtime.Caller-relative pathing — the new test needs the same path-resolution pattern."},{"path":"internal/intake/validate_test.go","reason":"Shows this package's table-driven test conventions and the hasViolation-style helper pattern the new test should follow for reporting per-field mismatches with a readable failure message."},{"path":"internal/intake/check_test.go","reason":"Smallest example of this package's test style (table setup, naming) for a newer, less load-bearing file than validate_test.go — quick second reference point."}],"pruned":["docs/adrs/ADR-010-factory-order-state-and-policy-configuration.md — covers claim-time pickup and run state, a different concern (factory scheduling) from this task's closed-vocabulary consistency check; excluded as a different bounded context within the same package.","internal/intake/check.go — Check() composes Parse+Validate+scanBody but does not touch vocabulary; not needed to write a vocabulary-comparison test.","internal/intake/parse.go — frontmatter splitting mechanics are orthogonal to comparing a closed vocabulary; the new test only needs Parse's already-demonstrated usage pattern from parse_test.go, not its internals."],"budget":{"files":[{"path":"internal/intake/vocabulary.go","bytes":1491,"estimatedTokens":372},{"path":"templates/claude-feature-team/intake/TEMPLATE.md","bytes":5569,"estimatedTokens":1392},{"path":"templates/claude-feature-team/intake/README.md","bytes":5735,"estimatedTokens":1433},{"path":"internal/intake/order.go","bytes":2414,"estimatedTokens":603},{"path":"internal/intake/validate.go","bytes":7107,"estimatedTokens":1776},{"path":"internal/intake/parse_test.go","bytes":4237,"estimatedTokens":1059},{"path":"internal/intake/validate_test.go","bytes":6553,"estimatedTokens":1638},{"path":"internal/intake/check_test.go","bytes":1497,"estimatedTokens":374}],"estimatedTokens":8647,"tierLimitTokens":160000,"status":"OK"}}