{"schemaVersion":2,"feature":"factory-idle-message","tier":"developer","targetStage":"developer","pinnedFiles":[{"path":"internal/factory/supervisor.go","reason":"Tick/Run/Once/Drain and the say()/record()/detail() console-output helpers already in use; the idle/waiting transition detection and the once-per-transition print are wired in here."},{"path":"internal/factory/replay.go","reason":"OrderState, Phase constants, Replay(), and IsActive() — the idle/waiting/running classification is built from these, not a new parallel state."},{"path":"internal/factory/start.go","reason":"pendingWork/isClaimable/activeCount already compute 'running' and 'claimable'; the AC's 'none claimable' must reuse this exact test, not reimplement it."},{"path":"internal/factory/intake.go","reason":"Candidate.IsClaimable/IsReady and the Intake struct — what 'committed' (already loaded by the tick) holds going into the claimability check."},{"path":"internal/factory/inbox.go","reason":"ItemKind/Inbox()/itemsFor() define the four waiting kinds (gate halt, commit proposal, PR proposal, parked) the AC names; the new count must agree with `loom factory inbox` without copying its filesystem/git calls (NFR: no extra pass per tick)."},{"path":"internal/factory/ledger.go","reason":"Event/Entry/Claim definitions (EventWaiting, EventProposed, EventParked, Claim.Finish) needed to classify phases from already-loaded state, with no new I/O."},{"path":"internal/factory/finish.go","reason":"finishCompleted's `Claim.Finish == \"none\"` rule — a completed order with finish:none ships immediately and is never a commit-proposal wait, so the waiting count must mirror this exactly or it will overcount."},{"path":"internal/factory/supervisor_test.go","reason":"Existing Tick-driven transition tests (e.g. TestAnOrphanedRunIsSettledFromItsState, TestTwoRunsStartAndTheThirdWaitsForASlot) are the style the new idle/waiting tests extend, asserting on the supervisor's output buffer."},{"path":"internal/factory/fixture_test.go","reason":"testFactory/orderSpec/fakeLauncher/tick()/inbox() fixtures the new tests drive; Dependencies.Output currently has no buffer wired in newSupervisor, so this is also where that gets added."},{"path":".claude/factory/claims/factory-idle-message.md","reason":"The feature spec itself — exact wording of both printed lines, the four phases that count as waiting, and the retrying-order open question's resolved assumption (not waiting)."}],"adrs":["docs/adrs/ADR-010-factory-order-state-and-policy-configuration.md"],"pruned":["internal/factory/control.go","internal/factory/settle.go","internal/factory/layout.go","internal/factory/summary.go","internal/factory/summary_test.go","internal/factory/launcher.go","internal/factory/process_unix.go","internal/factory/process_windows.go","internal/factory/lock_unix.go","internal/factory/lock_windows.go","internal/factory/units_test.go","internal/factory/lifecycle_test.go","internal/factory/faults_test.go","internal/memory/workspace.go (different bounded context — Documentation Knowledge Base, not touched by this change)","cmd/loom/cmd/* (change surface is console text inside internal/factory only; no CLI wiring changes needed)"],"budget":{"files":[{"path":"internal/factory/supervisor.go","bytes":4846,"estimatedTokens":1211},{"path":"internal/factory/replay.go","bytes":4927,"estimatedTokens":1231},{"path":"internal/factory/start.go","bytes":9066,"estimatedTokens":2266},{"path":"internal/factory/intake.go","bytes":4218,"estimatedTokens":1054},{"path":"internal/factory/inbox.go","bytes":9924,"estimatedTokens":2481},{"path":"internal/factory/ledger.go","bytes":8228,"estimatedTokens":2057},{"path":"internal/factory/finish.go","bytes":8511,"estimatedTokens":2127},{"path":"internal/factory/supervisor_test.go","bytes":11274,"estimatedTokens":2818},{"path":"internal/factory/fixture_test.go","bytes":10025,"estimatedTokens":2506},{"path":".claude/factory/claims/factory-idle-message.md","bytes":3547,"estimatedTokens":886}],"estimatedTokens":18637,"tierLimitTokens":160000,"status":"OK"}}