{"schemaVersion":2,"feature":"pre-ship-checks","tier":"analyst","targetStage":"analyst","pinnedFiles":[{"path":"internal/orchestrator/plan.go","reason":"Defines Stage/Plan, the gates map (confirm-ship is on devops-engineer), the skippable map, and DefaultDeliverFeaturePlan's agent sequence — the analyst must place the new pre-ship-checks stage between tech-writer and devops-engineer here."},{"path":"internal/orchestrator/router.go","reason":"The only existing executor-internal stage. runInternalStage's switch-of-one is the dispatch pattern pre-ship-checks extends; shows how an internal stage reads StageInput and returns StageOutput without a provider call."},{"path":"internal/orchestrator/executor.go","reason":"The run loop that calls runInternalStage, enforces per-stage Timeout, and persists stage status/artifacts — needed to know where command execution, the LOOM_BASE_COMMIT env var, and failure propagation plug in."},{"path":"internal/orchestrator/failure.go","reason":"Terminal-failure semantics: the AC requires a failing check to halt the run (never reach confirm-ship) without a supervisor retry, which this file's failure model governs."},{"path":"internal/policy/config.go","reason":"delivery-policy.yaml's Config struct, keptKeys/removedKeys, and strict LoadConfig — preShipChecks must be added here as a new kept key with the same reject-unknown-key discipline."},{"path":"internal/policy/decode.go","reason":"The strict per-key YAML-node decode idiom (decodeCondition/addEntry) this package already uses — the pattern to reuse for validating each preShipChecks entry's name/command/timeout and rejecting unknown keys."},{"path":"internal/policy/config_test.go","reason":"Existing config decode/rejection test style to mirror when adding tests for preShipChecks entries, including the no-name/no-command/unknown-key rejection cases."},{"path":"cmd/diff-coverage/run.go","reason":"Defines the --base and --profile flags scripts/pre-ship-check.sh must invoke exactly as CI does, so the script reproduces CI's own coverage gate."},{"path":"scripts/ci-diff-base.sh","reason":"An existing shell script in this repo's own house style (small, bash -c friendly) to match when writing the new scripts/pre-ship-check.sh."},{"path":"shared/skills/deliver-feature/SKILL.md","reason":"The prose stage sequence (steps 11, 13, 25) that plan.go's Go code mirrors — the source of truth for confirming the new stage's placement relative to tech-writer and the confirm-ship gate."}],"adrs":["docs/adrs/ADR-010-factory-order-state-and-policy-configuration.md"],"pruned":["mcp__loom__impact / mcp__loom__dependents_of / mcp__loom__find_files were unavailable this session (loom MCP server not registered) — blastRadius is omitted rather than guessed; the pinned set above was chosen by direct Grep over the stage-dispatch, config-decode, and diff-coverage call sites instead of a graph query.","Prior deliveries in this bounded context: docs/features/context-engineering-framework/analysis.md has Owning context 'Agent Orchestration', the same context this task touches, but that feature has no retrospective.md — no lesson to carry forward from it.","internal/policy/gate.go, internal/orchestrator/gate.go, docs/patterns/gate-enforcement.md — the confirm-ship gate's enforcement mechanics are unchanged by this feature (the gate stays on devops-engineer); only the new stage's position relative to it matters, which plan.go already shows.","intake/pre-ship-checks.md — a verbatim duplicate of the feature spec already supplied to this stage; no additional information.",".claude/policies/evidence-clean-ship.policy.yaml, shared/plans/deliver-bugfix.yaml — a different automation path (the Go policy evaluator) and a plan explicitly out of scope per the spec's Out of Scope section.","cmd/diff-coverage/main.go, cmd/diff-coverage/annotate.go, internal/gitdiff/gitdiff.go — diff-coverage internals beyond the CLI flags the script needs; run.go alone covers the invocation contract."],"budget":{"files":[{"path":"internal/orchestrator/plan.go","bytes":12800,"estimatedTokens":3200},{"path":"internal/orchestrator/router.go","bytes":6233,"estimatedTokens":1558},{"path":"internal/orchestrator/executor.go","bytes":26705,"estimatedTokens":6676},{"path":"internal/orchestrator/failure.go","bytes":2315,"estimatedTokens":578},{"path":"internal/policy/config.go","bytes":6089,"estimatedTokens":1522},{"path":"internal/policy/decode.go","bytes":6049,"estimatedTokens":1512},{"path":"internal/policy/config_test.go","bytes":5460,"estimatedTokens":1365},{"path":"cmd/diff-coverage/run.go","bytes":3808,"estimatedTokens":952},{"path":"scripts/ci-diff-base.sh","bytes":907,"estimatedTokens":226},{"path":"shared/skills/deliver-feature/SKILL.md","bytes":38217,"estimatedTokens":9554}],"estimatedTokens":27143,"tierLimitTokens":120000,"status":"OK"}}