{"schemaVersion":2,"feature":"e2e-fixture-gitignore","tier":"developer","targetStage":"developer","pinnedFiles":[{"path":"tests/e2e/testdata/repo/.gitignore","reason":"Does not exist yet — this is the file the task creates. Must ignore at least .claude/memory/ and .claude/feature-workspace/ per AC1."},{"path":".gitignore","reason":"Root .gitignore holds the two entries (.claude/memory/, .claude/feature-workspace/) the fixture's new .gitignore must mirror for the per-machine run state a loom-adopting repo ignores."},{"path":"tests/e2e/harness/deliver.go","reason":"setUpProject() runs copyTree then `git add -A` + `git commit` to make the project's first commit — the exact commit AC2 requires the .gitignore to land in and be read back from."},{"path":"tests/e2e/harness/exec.go","reason":"copyTree() walks the fixture tree via filepath.WalkDir — resolves the spec's Open Question about whether the copy skips dotfiles (it does not)."},{"path":"tests/e2e/harness/units_test.go","reason":"Home for small, package-internal assertions against Deliver/setUpProject (see fixtureWithoutRepo, TestDeliverRefusesABrokenFixture) — the natural place for the new first-commit .gitignore assertion required by AC2."},{"path":"tests/e2e/harness/harness_test.go","reason":"Contains TestTheFactoryDeliversTheFixtureOrder and TestTheHarnessFailsARunThatDeliversTheWrongThing, which AC3 and AC4 require to keep passing unchanged."},{"path":"tests/e2e/harness/harness.go","reason":"Defines Config, project()/origin() path helpers the new test needs to locate the project worktree and read its first commit."}],"pruned":["internal/worktree/** and internal/factory/** — own the :(exclude) pathspec / commit fix from #12; out of scope per spec, and this task reaches no further than tests/e2e/","cmd/** — explicitly out of scope","tests/e2e/testdata/solution/** and tests/e2e/testdata/hidden/** — the mock developer/QA solution and hidden acceptance tests; unrelated to a fixture .gitignore","tests/e2e/testdata/repo/go.mod, README.md, calc/** — fixture's own source files, untouched by adding a .gitignore","docs/features/e2e-fixture-gitignore/** — this run's own delivery record, the one path the AC explicitly allows outside tests/e2e/ but not something downstream needs to read to implement the change"],"budget":{"files":[{"path":"tests/e2e/testdata/repo/.gitignore","bytes":0,"estimatedTokens":0,"unmeasured":"cannot read tests/e2e/testdata/repo/.gitignore"},{"path":".gitignore","bytes":977,"estimatedTokens":244},{"path":"tests/e2e/harness/deliver.go","bytes":6219,"estimatedTokens":1554},{"path":"tests/e2e/harness/exec.go","bytes":1603,"estimatedTokens":400},{"path":"tests/e2e/harness/units_test.go","bytes":8102,"estimatedTokens":2025},{"path":"tests/e2e/harness/harness_test.go","bytes":4164,"estimatedTokens":1041},{"path":"tests/e2e/harness/harness.go","bytes":4571,"estimatedTokens":1142}],"estimatedTokens":6406,"tierLimitTokens":160000,"status":"INCOMPLETE","unmeasured":1}}